{
  "report_version": "1.0.0",
  "timestamp": "2026-08-18T07:41:16.798337+00:00",
  "harness_version": "1.0.0",
  "test_id": "self-test-l1-v2",
  "applies_to": [
    "eh-req-001",
    "eh-req-002",
    "eh-req-005",
    "eh-req-023",
    "eh-req-024"
  ],
  "verdict": "PASS",
  "test_count": 9,
  "passed": 9,
  "failed": 0,
  "skipped": 0,
  "not_run": 0,
  "not_run_reason": "n/a",
  "build_provenance": {
    "toolchain": "python 3.x (harness self-test)"
  },
  "coverage": {
    "total_requirements": 9,
    "tested_requirements": 9,
    "implemented_requirements": 9,
    "coverage_ratio": "9/9"
  },
  "evidence": [
    {
      "type": "log",
      "path": "tests/self-test-output.txt"
    }
  ],
  "requirements": [
    {
      "id": "T-00",
      "status": "PASS",
      "details": ""
    },
    {
      "id": "T-01",
      "status": "PASS",
      "details": ""
    },
    {
      "id": "T-02",
      "status": "PASS",
      "details": ""
    },
    {
      "id": "T-03",
      "status": "PASS",
      "details": ""
    },
    {
      "id": "T-04",
      "status": "PASS",
      "details": ""
    },
    {
      "id": "T-05",
      "status": "PASS",
      "details": ""
    },
    {
      "id": "T-06",
      "status": "PASS",
      "details": ""
    },
    {
      "id": "T-07",
      "status": "PASS",
      "details": ""
    },
    {
      "id": "T-08",
      "status": "PASS",
      "details": ""
    }
  ]
}